{"specId":"ui-1","schemaVersion":"2.0","contentHash":"aaaaaaaaaaaaaaaaaaaaaaaaaaaaaaaaaaaaaaaaaaaaaaaaaaaaaaaaaaaaaaaa","source":{"sourceType":"FIGMA","fileKey":"f1","nodeId":"1:2","sourceRevision":"r1"},"designSystemSnapshotRef":null,"nodes":[{"semanticId":"root","role":"page","logicalType":null,"geometry":null,"layoutConstraints":{},"componentRef":null,"evidence":{"sourceNodeRefs":["1:2"],"confidence":1,"inferenceMethod":"FIGMA_TREE","requiresReview":false,"legacyUnknown":false},"tokenBindings":[],"interactionCandidates":[]}],"responsivePolicySet":[],"responsiveStructureSet":[{"viewportId":"desktop","visibleSemanticIds":["root"],"order":["root"]}],"renderabilityAssessments":[{"semanticId":"root","decision":"NATIVE","lossDescription":null,"approved":true}],"issues":[],"confidenceSummary":1}
